{
  "record_id": "vendor-quote-2026-08",
  "source": {
    "kind": "document",
    "reference": "approved-vendor-quote.pdf",
    "observed_at": "2026-08-20T09:30:00Z"
  },
  "scope": "procurement / packaging refresh",
  "proposed_action": "prepare a renewal draft",
  "freshness": {
    "review_by": "2026-08-27T09:30:00Z",
    "status": "stale",
    "reason": "The quote expired before the draft would be sent."
  },
  "human_return": {
    "required": true,
    "reason": "A current quote and an external commitment require review."
  }
}
